{
  "detected_at": "2026-09-10T01:33:01.374669Z",
  "from_t": -235,
  "to_t": 180,
  "system": [
    {
      "seq": 1,
      "t": -236,
      "kind": "run.started",
      "label_zh": "回合開始,基線收集中。"
    },
    {
      "seq": 2,
      "t": -112,
      "kind": "baseline.captured",
      "label_zh": "基線收集完成並凍結。"
    },
    {
      "seq": 3,
      "t": -111,
      "kind": "fault.instance.changed",
      "label_zh": "故障實例 fault-1789003870514299000-1 狀態變為 applying。"
    },
    {
      "seq": 4,
      "t": -111,
      "kind": "config.revision_changed",
      "label_zh": "故障實例 fault-1789003870514299000-1 狀態變為 active。"
    },
    {
      "seq": 5,
      "t": -111,
      "kind": "fault.activated",
      "label_zh": "故障卡已套用到 shop。"
    },
    {
      "seq": 6,
      "t": 0,
      "kind": "incident.detected",
      "label_zh": "偵測到訂單失敗率升高"
    },
    {
      "seq": 7,
      "t": 0,
      "kind": "snapshot.pinned",
      "label_zh": "事故前後的 graph snapshot 已釘住。"
    },
    {
      "seq": 8,
      "t": 0,
      "kind": "investigation.started",
      "label_zh": "開始排查"
    },
    {
      "seq": 9,
      "t": 4,
      "kind": "tool",
      "label_zh": "回看 catalog 過去 15 分鐘",
      "tool": "get_node_history",
      "node": "catalog"
    },
    {
      "seq": 10,
      "t": 4,
      "kind": "tool",
      "label_zh": "已讀取節點歷史序列。",
      "tool": "get_node_history",
      "node": "catalog"
    },
    {
      "seq": 11,
      "t": 7,
      "kind": "tool",
      "label_zh": "找 catalog 的 trace",
      "tool": "find_traces",
      "node": "catalog"
    },
    {
      "seq": 12,
      "t": 7,
      "kind": "tool",
      "label_zh": "已搜尋符合條件的 trace。",
      "tool": "find_traces",
      "node": "catalog"
    },
    {
      "seq": 13,
      "t": 10,
      "kind": "tool",
      "label_zh": "讀 trace",
      "tool": "get_trace"
    },
    {
      "seq": 14,
      "t": 10,
      "kind": "tool",
      "label_zh": "已讀取 trace 路徑。",
      "tool": "get_trace"
    },
    {
      "seq": 15,
      "t": 12,
      "kind": "tool",
      "label_zh": "查看 catalog 詳情",
      "tool": "get_node_detail",
      "node": "catalog"
    },
    {
      "seq": 16,
      "t": 12,
      "kind": "tool",
      "label_zh": "已讀取節點目前詳情。",
      "tool": "get_node_detail",
      "node": "catalog"
    },
    {
      "seq": 17,
      "t": 20,
      "kind": "hypothesis.concluded",
      "label_zh": "AI 提出結論"
    },
    {
      "seq": 18,
      "t": 19,
      "kind": "action.proposed",
      "label_zh": "提案等待批准"
    },
    {
      "seq": 19,
      "t": 135,
      "kind": "approval.recorded",
      "label_zh": "操作員批准"
    },
    {
      "seq": 20,
      "t": 135,
      "kind": "action.started",
      "label_zh": "執行 rollback_config"
    },
    {
      "seq": 21,
      "t": 135,
      "kind": "action.completed",
      "label_zh": "執行 rollback_config"
    },
    {
      "seq": 22,
      "t": 135,
      "kind": "fault.instance.changed",
      "label_zh": "故障實例 fault-1789003870514299000-1 狀態變為 restoring。"
    },
    {
      "seq": 23,
      "t": 135,
      "kind": "fault.restored",
      "label_zh": "shop 設定已推回 pristine。"
    },
    {
      "seq": 24,
      "t": 160,
      "kind": "verification.window_completed",
      "label_zh": "驗證窗口 1"
    },
    {
      "seq": 25,
      "t": 180,
      "kind": "verification.window_completed",
      "label_zh": "驗證窗口 2"
    },
    {
      "seq": 26,
      "t": 180,
      "kind": "verification.completed",
      "label_zh": "兩個 20 秒恢復窗口都通過。"
    },
    {
      "seq": 27,
      "t": 180,
      "kind": "incident.completed",
      "label_zh": "結案:已恢復"
    }
  ],
  "ai": {
    "status": "accepted",
    "onset": {
      "node": "catalog",
      "t": -115,
      "signal": "sat"
    },
    "propagation": [
      {
        "node": "catalog",
        "t": -15,
        "signal": "err"
      },
      {
        "node": "checkout",
        "t": 0,
        "signal": "err"
      },
      {
        "node": "storefront",
        "t": 0,
        "signal": "err"
      }
    ]
  },
  "measured": {
    "deviations": [
      {
        "node": "catalog",
        "axis": "latency",
        "t": -95
      },
      {
        "node": "catalog",
        "axis": "saturation",
        "t": -90
      },
      {
        "node": "catalog",
        "axis": "errors",
        "t": -11
      },
      {
        "node": "checkout",
        "axis": "errors",
        "t": -11
      },
      {
        "node": "checkout",
        "axis": "latency",
        "t": -11
      },
      {
        "node": "shopper",
        "axis": "errors",
        "t": -11
      },
      {
        "node": "shopper",
        "axis": "latency",
        "t": -11
      },
      {
        "node": "storefront",
        "axis": "errors",
        "t": -11
      },
      {
        "node": "storefront",
        "axis": "latency",
        "t": -11
      }
    ]
  },
  "truth": {
    "card_id": "catalog_pool_leak",
    "t_injected": -111,
    "curve": [
      [
        -111,
        6
      ],
      [
        -59,
        6
      ],
      [
        -7,
        6
      ],
      [
        46,
        6
      ],
      [
        98,
        6
      ],
      [
        150,
        6
      ],
      [
        202,
        6
      ],
      [
        254,
        6
      ],
      [
        306,
        6
      ],
      [
        359,
        6
      ],
      [
        411,
        6
      ],
      [
        463,
        6
      ],
      [
        515,
        6
      ],
      [
        567,
        6
      ],
      [
        619,
        6
      ],
      [
        672,
        6
      ],
      [
        724,
        6
      ],
      [
        776,
        6
      ],
      [
        828,
        6
      ],
      [
        880,
        6
      ],
      [
        932,
        6
      ],
      [
        985,
        6
      ],
      [
        1037,
        6
      ],
      [
        1089,
        6
      ]
    ],
    "root": "catalog",
    "mechanism_family": "db_pool_leak",
    "expected_action": "rollback_config:catalog",
    "expected_order": [
      "catalog",
      "checkout",
      "storefront"
    ]
  }
}
